Лига Ставок, "Плюсы: Быстрые выводы, фрибеты, хорошие коэффициенты. Минусы: Минусов я не обнаружила. Комментарий: Здравствуйте, уважаемые читатели Отзовика.Так как я часто смотрю футбол и хоккей, увлекаюсь и просмотром других спортивных игр, то изредка ставлю деньги на события матчей. Моя первая букмекерская контора была и есть ""Лига ставок"". Так как я не играю на крупные суммы, то меня эта контора вполне устраивает. Главный плюс то, что можно вывести любую сумму от 100 рублей на банковский счёт и от 1000 рублей на банковскую карту. вывод на счёт идёт примерно сутки, иногда приходит раньше. А вот вывод на карту осуществляется в тот же день.Также плюс в том, что можно пополняться с банковской карты без процентов. Зачисления приходят моментально.Очень нравиться сайт ""Лиги ставок"", красивый дизайн, удобное расположение просмотра ставок и отслеживания.В случае каких=либо вопросов вы можете обратиться в чат, где консультант ответит вам в течении нескольких минут, и поможет решить вашу проблему.НО если вы человек азартный, не советую начинать играть.Таким образом, хочу сказать, что в букмекерской конторе ""Лига ставок"" меня всё устраивает.Спасибо, что уделили время на прочтение моего отзыва. ", 2019-02-22, 5, Otzovik.com, KristaFan, " Быстрые выводы, фрибеты, хорошие коэффициенты. ", " Минусов я не обнаружила. "
Лига Ставок, "Плюсы: Игра,да и только Минусы: Может затянуть Комментарий: Всем привет. Сегодня я расскажу Вам своё мнение о букмекерской конторе «Лига ставок». Мое знакомство с этим приложением началось три месяца назад и сейчас я могу поделиться своими впечатлениями. До того, как установить это приложение я решила почитать отзывы и они очень не однозначны... кто-то в восторге, а кто-то в полном ужасе от огромных проигрышей, но я решила лично на себе проверить. За три месяца я пришла к таким выводам и могу выделить несколько обязательных пунктов для того, чтобы хотябы не проиграть большие деньги!1. Никогда не ставьте большие суммы на маленькие коэффициенты! Именно на этом многие и проигрывают, думаю что вот вот именно он то и сядет! но нет!2. Лучше ставить системы 4 из 8,5 из 8, тут будет шанс хотя бы отбить своё.3. Лучше мониторить игры и хотя бы шерстить статистику, делая ставки на бум велика вероятность проигрыша! ", 2019-03-17, 4, Otzovik.com, Angell100, " Игра,да и только ", " Может затянуть "
Лига Ставок, "Плюсы: Деньги выводятся и проста Минусы: Зарегистрироваться проблематично Комментарий: С 2012 года начал играть в букмекерских конторах, а именно а букмекерской конторе Лига ставок. Сначала начал с мелочи бренчавшей в кармане и дошёл постепенно до сумм, в десятки тысяч рублей в выплатах выигрышей проблем никогда не было.Единственное интерфейс конторы желает лучшего и ещё нету функции продать ставку, а так реальная рабочая букмекерская контора.Управление, вывод, пополнение счёта все функции просты и доступны для понимания рядового игрока. Коэффициент не один из самых высоких, но и приемлемым для капперов.Являюсь игроком конторы Зенит и до сих пор, не могу соскочить.Играйте и выигрывайте в Лиге ставок. ", 2019-04-29, 3, Otzovik.com, Gjkzyjxrf, " Деньги выводятся и проста ", " Зарегистрироваться проблематично "
Лига Ставок, "Плюсы: Нет Минусы: Выиграть возможно, а деньги забрать - нет! Комментарий: Здравствуйте, уже состоявшиеся и только начинающие игроки! Буду краток: мне не выплатили выигрыш в размере 55 000 руб., а затем ещё и сумму ставок до 10 руб. ""порезали"". Вывод делайте сами! )) ", 2019-07-09, 1, Otzovik.com, Buriy31, " Нет ", " Выиграть возможно, а деньги забрать - нет! "
Лига Ставок, "Плюсы: Одни плюсы Минусы: Нет минусов Комментарий: Всем привет, хочу оставить свой отзыв о данной конторе. Пользуюсь их услугами уже около 3 лет, очень все хорошо, никогда не блокировали учетную запись из за больших выигрышей, как некоторые пишут, бывало даже с 500 рублей поднимал 50000. Служба поддержки всегда отвечает оперативно, в чате на сайте очень удобно с ними общаться. Удобно выводить деньги через ЦУПИС, много способов вывода. Да и вообще БК Лига Ставок одна из более менее надежных на сегодняшний день контор. Часто дают фрибеты, особенно новичкам. Помню мне дали фрибет 200 рублей, я поставил его на все матчи НХЛ на победы с ОТ и выиграл 2800, моему счастью не было предела))). ", 2019-08-03, 5, Otzovik.com, saul74, " Одни плюсы ", " Нет минусов "
Лига Ставок, "Плюсы: Есть бонусы Минусы: Неудобная линия,плохой сервис! Комментарий: Самая дырявая контора из всех что я знаю! Ставлю онлайн. Проигрышные ставки рассчитывают моментально! Выиграшные-же в течении 2х суток рассматривают, даже если 50р поставил! Вывод средств тоже двое суток ждёшь! Когда звонишь на горячую линию :оператор здаровается ты с ним тоже, задаёшь ему вопрос он говорит-извините вас не слышно, перезвоните позже и кидает трубку! Не кому не советую играть с этим букмекером! ", 2019-08-11, 1, Otzovik.com, Олег33567, " Есть бонусы ", " Неудобная линия,плохой сервис! "
Лига Ставок, "Плюсы: Плюсов не вижу Минусы: Я все описал Комментарий: Сделал ставку до начала игры в настольный теннис, счёт на экране был 0-0, посмотрел на другой сайт, там уже тот, на кого я поставил, проигрывал 8-4) через минуту Лига ставок дала результат 10-5, естественно, не в мою пользу) Позвонил оператору, мне было сказано, что это все носит информативный характер, и все по делу) До этого ставил нормальную сумму на баскет, доехал, пришел забрать деньги- возврат. Сказали- я поставил уже во время матча, хотя начало они писали в 15-00, а я поставил в 14-45) Гнилье, а не контора. ", 2018-12-25, 1, Otzovik.com, Иваныч 81, " Плюсов не вижу ", " Я все описал "
Лига Ставок, "Плюсы: Нету Минусы: Полный минус Комментарий: Поставил 250000тыс на футбол выиграл 3 часа рассчитывали, потом заблокировали карты на месяц ! Буду судиться! Сама конченая контора!! советую никому туда не ходить ", 2019-05-19, 1, Otzovik.com, Александр888888, " Нету ", " Полный минус "
Лига Ставок, "Плюсы: Простой интерфейс приложения, низкие суммы ставок Минусы: Высокие суммы вывода денег, лайв ставки Комментарий: Пользуюсь букмекерской конторой ""Лига Ставок"" около одного года. Конечно, я не заядлый игрок, ставлю только ради того, чтобы интересно было смотреть матчи.Довольно простой интерфейс мобильного приложения, если сравнивать с некоторыми другими. Разобраться, что, где, как ставить быстро. Сумма ставок от 10 рублей, пополнение такой же критерий, но вывод только с 1000 рублей.Минус приложения, да и ставок на сайте, что в лайве очень трудно поставить на меняющиеся коэффициенты, в приложении вообще все зависает и отвисает только, если в игре наступила некоторая пауза. Присутствует много разнообразных ставок, даже на политику, но большинство из них появляются только перед самим событием. ", 2019-06-23, 4, Otzovik.com, Jack Spades, " Простой интерфейс приложения, низкие суммы ставок ", " Высокие суммы вывода денег, лайв ставки "
Лига Ставок, "Плюсы: приятное на глаз приложение ( и то может из за того что привык ) другими БК не пользовался можно сказать! Минусы: приложение все чаще глючит, все дольше надо ждать расчеты, задержка в онлайне в дольше и дольше Комментарий: Делал ставки у них около двух лет все вроде было норм пока вчера случайно не перепроверил результат ставки как оказалось что у них результат один а во всех остальных БК и не только совсем другой (1Xставка, Марафон, 777score) и даже у них в приложении показывает счет правильный и не правильный одновременно ! короче в итоге сказали в поддержке ""Расчет пари производится на основании официальных данных."" официальные данные только у них не такие как у всех остальных! а если перепроверить мои прошлые все пари думаю там не мало таких моментов найду !и вот пункт конечно огонь)Согласно пунку правил 2.1. Букмекерская Компания заявляет о стремлении предоставлять информацию по событиям, представленным в Линии, корректно, своевременно и в максимально полном объёме. Вместе стем, Букмекерская Компания не несёт никакой ответственности за правильность, полноту исвоевременность предоставляемой информации. ", 2019-07-01, 2, Otzovik.com, Robingood12, " приятное на глаз приложение ( и то может из за того что привык ) другими БК не пользовался можно сказать! ", " приложение все чаще глючит, все дольше надо ждать расчеты, задержка в онлайне в дольше и дольше "
Лига Ставок, "Плюсы: Нет Минусы: Разводят Комментарий: Занёс 600р сделал ставку, увеличил до 1000р... Поставил заявку на снятие... Заявка была отменена и на баланс - 1199р... В службе поддержки объяснили это тем что раньше мной была сделана ставка по которой я выйграл но у них была техническая ошибка и выйгрыш я получил 'неправильный'... Теперь я должен букмекерской контореВыводы делайте сами... ", 2019-08-11, 1, Otzovik.com, Мистер777, " Нет ", " Разводят "
Лига Ставок, "Плюсы: Нет Минусы: Низкие коэффициенты, долгий выод денег Комментарий: Всем здравствуйте, хочу рассказать про данную контору. Регистрация здесь происходит также, как и других легальных букмекерских конторах: регистрируешься на сайте с паспортными данными и подтверждаешь их в любом клубе данной организации в своем городе. Очень удобно, что есть фрибет 500 рублей, которые если приложить навыки в ставках можно увеличить, но если выиграл то из выигрыша вычитается 500 рублей фрибета. Если проиграл, то ничего не должен. Ставки ставить удобно от 10 рублей, в некоторых бк от 50 рублей. Коэффициенты на ставки средние, иногда даже низкие, в сравнении с другими бк, я их не буду называть. Забыл сказать, что также будет нужна регистрация в цупис, для вывода денег. Без нее нельзя. Выплата выигрыша производится на карту, с которой пополнял счет, на другую нельзя. Выводить на карту можно только от 1000 рублей или на счет карты от 100 рублей, что очень не удобно и долго. Линия ставок скудная, в других бк намного шире. Вот наверное и все. Может мой отзыв будет кому-то полезен. Всем удачи, до свидания.  ", 2018-02-02, 2, Otzovik.com, VladMalygin, " Нет ", " Низкие коэффициенты, долгий выод денег "
Лига Ставок, "Плюсы: легальный букмекер Минусы: проблемы с выводом есть конторы намного лучше Комментарий: Моё знакомство с данной конторой произошло где -то полгода назад, удалось поставить фрибет, там давалось 1000 рублей фрибетом, то есть бесплатная ставка, я выиграл, еле как вывел деньги, комиссия составила 10%. После этого я забыл об этой конторе на 3 месяца, но она напоминала о себе постоянно, то раз в неделю звонили на телефон, предлагали сделать ставку, то смс писали. Я все таки решил опять начать делать ставки поставил 100 рублей, выиграл 90, но чтобы вывести надо чтобы сумма была не меньше 1000, в итоге я положил 900 рублей, попытался вывести, но мне было отказано, по какой причине непонятно, пришлось выводить через кошелек, там была комиссия 10%, в итоге от моего выиграша не осталось ничего, я еще и 20 рублей должен остался. Есть легальные конторы и получше, но еще лучше не делать ставки на большие суммы, а то у меня были случаи когда с коэффициентом 1,03 ставка проигрывала. ", 2019-03-22, 2, Otzovik.com, eroregor, " легальный букмекер ", " проблемы с выводом есть конторы намного лучше "
Лига Ставок, "Плюсы: Выплачивают выигрыши без предварительных заявок и прочих пробуксовок. Минусы: Линия и интерфейс ставкоматов. Комментарий: Я всю свою жизнь играю в разные азартные игры. Казино, букмекерка, фондовая биржа. Раньше ездил играть в Азов сити, но после закрытия игорной зоны съездил несколько раз в казино Сочи, там мне не понравилось. И я решил за отсутствием достойных казино и интересной игры, поиграть в букмекерке. Раньше играл в Фонбете, там на мой взгляд самая удобная линия, у Лиги ставок интерфейс ужасно неудобный. Но! выигрыши выплачивают, лично мне выплатили, сумма небольшая, однако в нашем городе(Воронеж) с фрибета в 555 рублей какие то студенты из Туркмении собрали экспресс с коэфф. 1450. общий выигрыш был 807 тысяч и им все выплатили! Разыгрываются фрибеты и гаджеты. И дают пиво и снеки за ставки от тысячи рублей. Удивляюсь как они еще умудряются держатся на плаву с такими акциями и стимулирующими лотереями. Поэтому я и начал играть в Лиге ставок. Один недостаток-ужасно неудобная линия. Разбросанно все в хаотичном порядке. Эта линия просто злит, найти нужный матч бывает очень и очень сложно, почему нельзя дополнительные ставки просто поместить в рубрику чемпионата? Ищещь линию ФНЛ а на глаза попадаются какие то ""ФНЛ игроки"", ФНЛ Нарушения"", ФНЛ Итоги"", ФНЛ Статистика"". Зачем ? ", 2019-05-02, 4, Otzovik.com, Олег1348, " Выплачивают выигрыши без предварительных заявок и прочих пробуксовок. ", " Линия и интерфейс ставкоматов. "
Лига Ставок, "Плюсы: Хорошие коэффициенты Минусы: Долго ждать выплату Комментарий: Пару лет назад решила попробовать заработать на букмекерской конторе и конечно без какого либо опыта в данной области спустила пол зарплаты. Скажу в целом сдесь можно заработать, но необходимо разбираться хотя бы в каком-нибудь спорте. Коэффициенты приличные, так что если ставить туда куда надо, то в накладе не останешься. За другие букмекерские конторы не знаю, но лига ставок регулярно дарит бесплатные фрибеты, что очень радует. При возникновении любых вопросов, операторы всегда придут на помощь. Выплату иногда приходится ждать и по несколько часов, но в результате выводят. Вцелом не плохая букмекерская контора! ", 2018-05-15, 5, Otzovik.com, detka363, " Хорошие коэффициенты ", " Долго ждать выплату "
