Лига Ставок, "Плюсы: Плюсов нет. Минусы: Технические неполадки. Комментарий: Зарегистрировался не так давно в данной букмекерской конторе и сразу же пожалел об этом. Если учитывать то, что ""Лига ставок"", стала первой в России букмекерской конторой по приему интерактивных ставок (через интернет), то на ум, сразу же, приходит старинная русская пословица, про первый блин, который всегда комом. Считаю, что данная БК, вообще не предназначена для ставок через интернет, по одной простой причине. Не возможно делать ставки на сайте, который не работает ! А сайт у них реально не работает. Через каждые 5-10 минут необходимо авторизоваться, так как с сайта выбрасывает. По словам службы поддержки, это происходит, для какой-то дополнительной защиты, если наблюдается длительная не активность на сайте. Под длительной, подразумевается, 5 минутная не активность. После чего, тебя выкидывает с сайта, и при повторной авторизации, попадаешь снова на главную страницу. Я считаю, что это делается намеренно, что бы создать неудобства игрокам и мешать им делать обдуманные ставки. Получается так, что, что бы сделать ставку, нужно, либо сделать это быстро, в течении 5ти минут, либо постоянно двигать мышкой и создавать какую-то активность, что бы тебя, не выкинуло обратно на главную страницу. А потом заново искать событие, которое ты выбрал. Все это очень, мягко говоря, не удобно. А играть в ""лайве"", просто невозможно. Это только пол беды. После выбросов с сайта, авторизоваться получается не с первого раза. Not found и "" Ой ! Что-то пошло не так ! "", постоянное явление в ""Лиге ставок"". Опять же считаю, что это происходит, не по техническим причинам, а из-за движения линии в ""лайве"". Ни когда не поверю, что бы за год существования, невозможно было, решить технические неполадки сайта. Это техническая сторона вопроса. Что касается всего остального, то плюсов у данного букмекера я так же не обнаружил. Коэффициенты занижены. Ставки рассчитывают очень долго Дизайн и навигация по сайту, оставляет желать лучшего. Плохой фильтр по событиям. Начинающим игрокам, очень сложно будет, сориентироваться на сайте. Меня хватило ровно на один день игры в данной конторе, за который, с горем пополам, я успел сделать две ставки. После чего, решил вывести свои деньги обратно, на электронный кошелек. Ждать пришлось около четырех часов. Вывод ! Самый первый букмекер России по приему интерактивных ставок, делать это, либо не хочет, либо не может ! ", 2017-06-02, 1, Otzovik.com, Roman Dyadyuckin, " Плюсов нет. ", " Технические неполадки. "
Лига Ставок, "Плюсы: Красивый сайт Минусы: Договор позволяющий ""обнулять"" выигрыш. Комментарий: 13 МАЯ зарегистрировался на сайте Лига ставок и параллельно прошел регистрацию в 1 ЦУПИС;16 МАЯ только смог подтвердить электронный адрес и получить код для подтверждения личности - типа технические работы велись;17 МАЯ пришел в клуб (Красногорск, Ленина 40) с паспортом чтобы пройти идентификацию через час стояния у окошка выяснилось, что в программе в моем типа аккаунте подтянулась какая-то левая почта и идентификацию пройти нельзя - соответственно появилась первая заявка в ""кипящую"" линию № 634422;22 МАЯ ситуация осталась ровно на том же месте - появляется еще одна заявка № 638509;23 МАЯ признаться честно нервы стали сдавать и я наехал на ни в чем неповинную девочку из ""кипящей"" линии - еще одна бессмысленная как потом оказалось заявка № 639494;31 МАЯ мне позвонили и сообщили, что решение вопроса нашлось - снесли всю мою регистрацию и теперь типа заново надо регистрироваться и все будет ОК;ОК так ОК03 ИЮНЯ заново прошел регистрацию и приперся в клуб проходить идентификацию - АГА, РАЗМЕЧТАЛСЯ - типа сбой в программе - паспортные данные еще тогда занесли, какая-то ошибка с кодом 5000, и паспортные данные невозможно отправить на сервер - еще одно обращение № 646533А еще были обращения из клуба в техподдержку не знаю сколько там - может 100, а может 200.В итоге по полчаса каждый раз общения с горячей линией, по часу стояния в клубе и НИЧЕГО.Я вот просто так шел сегодня домой и думал, а может это бог меня просто бережет от КОНТОРЫ этой?Ну и последнее, это для тех, кто мечтает нахаляву бабла подрубить - выдержка из Договора, который как это у нас водится мало кто читает -п. 8.6.""Букмекерская Компания оставляет за собой право в любой момент отменять пари, если при заключении или расчёте пари на сервере, в базе данных Букмекерской Компании произошли технические или программные сбои.""п. 8.10. - ""Букмекерская Компания оставляет за собой право отказать Клиенту в заключении пари без объяснения причин в соответствии с настоящими Правилами.""п. 10.8. ""Букмекерская Компания оставляет за собой право в любой момент изменять размер максимального выигрыша по событию, а также размер максимального выигрыша для каждого Клиента.""п. 11.3. ""При возникновении технических сбоев Букмекерская Компания оставляет за собой право производить расчёт выигрыша с коэффициентом «1»""НУ ЧТО, ГОСПОДА, У КОГО-ТО ЕЩЕ ОСТАЛИСЬ СОМНЕНИЯ?КРАСИВО ВСЕ СДЕЛАЛИ - ДА? :)) БИЗНЕС ПО РУССКИ ДЛЯ ПОЛНЫХ ЛОХОВ. ", 2017-06-04, 1, Otzovik.com, i1981pad, " Красивый сайт ", " Договор позволяющий ""обнулять"" выигрыш. "
Лига Ставок, "Плюсы: Много способов для оплаты, понятный и удобный интерфейс, внушительное разнообразие для ставок ( вплоть до выборов президента)в том и числе и в лайве. Минусы: Задержки с выплатами , коэффициенты Комментарий: Добрый день. Хочу поделиться своим опытом в ставках с этой конторой. Все что касается пополнения счета - тут они молодцы: сделали всё, чтоб никаких заморочек с оплатой у клиента не возникало.Далее будет сплошной негатив. Коэффициенты занижены - когда у многих других контор он составляет 2.00 или выше, Лига Ставок даст не более 1.90.Теперь по-существу, по самим ставкам. Было на примете одно событие - Финал Лиги Чемпионов: Барселона - Ювентус (впрочем больше я ни на что ставить не собирался). Зарядил тогда на Барсу 10000 кровных с кф 1.60. Смотрел, переживал - ставка, в общем, прошла. На следующее утро решил вывести выигрыш и забыть надолго о ставках. Зайдя в личный кабинет обнаружил там ровнехонько 10 тыщ(тобиш сделали возврат по ставке). Делать нечего - стал разбираться. После резонного письма в поддержку с недоумением - получил через некоторое время ответ, мол Вы уважаемый клиент играете нечестно!! и знали результат заранее!!, а потому Мы аннулируем Ваш выигрыш и возвращаем деньги на счет и более не хотим иметь с вами дел.Спорили долго - около недели пытался добиться своих честно заработанных - в итоге с горем пополам выплатили.Вывод : Если вы часто проигрываете, то непременно будете их лучшим клиентом. Если (НЕ ДАЙ БОГ!!) тьфу тьфу тьфу ... соизволите там что-то поднять, то приготовьтесь- деньги просто так вам никто не заплатит. Могут потребовать паспорт, телефон, фото в 10 позах, кровь единорога - ибо по-другому закон не позволяет (а при регистрации, пополнении, и своершении ставки почему - то позволял))) ", 2015-12-25, 3, Otzovik.com, krespo29, " Много способов для оплаты, понятный и удобный интерфейс, внушительное разнообразие для ставок ( вплоть до выборов президента)в том и числе и в лайве. ", " Задержки с выплатами , коэффициенты "
Лига Ставок, "Плюсы: Хорошие, честные бонусы Минусы: Налог 13%, Линия не очень, Мало способов вывода Комментарий: Решил написать отзыв не столько о конторе, сколько об очень вкусном бонусе 3000р. за регистрацию, этот бонус мне дали, я с него выйграл 4500р. и в течении суток деньги мне вывели на Qiwi т. е свои обязательства БК выполняет, но на постоянной основе я бы эту контору не рекомендовал, во первых нет клиента, т. е линия в браузере (мне удобно когда клиент скачиваемый) кэфы на события пониже чем у конкурентов, способов вывода денег тоже мало 4 помойму, но и 13% налога с каждого вывода(( налоги это конечно хорошо, я не против них, но я очень сомневаюсь что эти налоги идут в налоговую от моего имени ", 2016-09-18, 3, Otzovik.com, Аноним930734, " Хорошие, честные бонусы ", " Налог 13%, Линия не очень, Мало способов вывода "
Лига Ставок, "Плюсы: Зарегестрирована в Гибралтаре Минусы: Исключительно порядочные люди. Комментарий: ""Дивная, чудная компания.""Мы много раз спрашиваем друг друга почему мы так плохо живем? А вот поэтому!!! Когда паразиты-вроде ""Лига ставок"" мудрят с веб адресами, меняя их каждые две недели. Блокируют карты, не имея на то оснований. Задерживают выплаты и рассмотрения заявок на вывод средств. Причем крайними становятся операторы горячей линии, вынужденные прикрывать эти косяки, рассказывая сказки и небылицы о проблемах банка. Причем эти проблемы возникают только при снятии средств со счета. При пополнении оного, проблем не возникает. А было бы неплохо, чтобы соответствующие органы заинтересовались этой прекрасной компанией, зарегистрированной кстати в Гибралтаре и плюющее на Российское законодательство, требующая от своих пользователей рассылку конфиденциальной информации о себе и тыкая в лицо каким то договором. Господа руководители компании, договор считается юридически состоятелен когда под ним стоят подписи и печати двух сторон. Не надо дурачить народ. А пользователям скажу так. Не дай вам бог выиграть в этой компании большую сумму. Эти люди не знают значения слова ""Пари"" и ""Чести"". Главное это деньги!!! А вы быдло!!! А у быдла не должно быть денег!!! И по отношению к быдлу не может быть чести. Так что удачи всем пользователям. ", 2016-11-24, 1, Otzovik.com, ygerman151273, " Зарегестрирована в Гибралтаре ", " Исключительно порядочные люди. "
Лига Ставок, "Плюсы: Очень простая и быстрая регистрация Минусы: Все нюансы знать невозможно Комментарий: Играть или нет в азартные игры это личное мнение каждого, вот я например решила чуть-чуть рискнуть.Например хорошо, то что при регистрации на сайте дают бонус 500 рублей+ бонус в офисе 300 рублей, регистраци абсолютно бесплатная и не тяжлая, сначала на сайте регистрируешься, затем едишь в контору и там подтверждаешь регистрацию, это занимает буквально 5 минут, стаки ставить просто и понятно, даже для такого человека, как я которая раньше этим не особо интересовалась. Если ты не очень азартный человек, то для тебя это самое то, то есть ты можешь никаких наличных не ставить, только бонусы поставить, а выйграть наличные и забрать и больше туда не возвращаться. правда., как и везде много нюансов про которые тебе естественно не рассказывают, об этом ты узнаешь только при попытке например вывести деньги, например то, что вывести меньше 1000 рублей нельзя, но как подсказку вам напишу, вы можете просто со своей карты доложить туда если у вас не хватает до тысячи и сразу же снять не играя, это все сделано, для не внимательных людей, которые вместо этого продолжают играть чтобы выйграть до тысячи и просаживают все. ", 2016-12-09, 4, Otzovik.com, Victory2302, " Очень простая и быстрая регистрация ", " Все нюансы знать невозможно "
Лига Ставок, "Плюсы: Удобный классный интерфейс. Не плохие коэфициенты Минусы: Режут ставки ! ! Комментарий: Играл на cybbet.com более 3 месяцев . Играл с переменным успехом когда выигрывал, когда проигрывал. Но в последний момент начал играть по безопаснее по минимальным коэфициентам, но что бы гарантированно выйграть. Когда в последнее время начал выигрывать у меня на счету уже скопилось чуть более 300 $ начал потихоньку выводить по 30 $ в день. НА третий день после вывода я захожу на свой аккаунт и замечаю что я не могу делать ставку более 1 $. Я пишу сразу в чат с моментом разобраться ( думал может какие то работы идут ). НА что мне был ответ что наш трейдер решил вам сделать такую ставку. Я спрашиваю а почему именно мне за что ? Я же честно играл не нарушал правил. НА что мне оператор сайта www.cybbet.com ответил, что по правилам они имеют право урезать ставки не объясняя причин. ВЫвод мой ! Компания www.cybbet.com заинтересована что бы только она зарабатывала а вы них**а. Если вы начнете зарабатывать вам сразу будут резать ставки. Поверьте проверено мною. Сейчас играю на других сайтах всё таки есть в России нормальные конторы которые также позволяют зарабатывать игрокам. ПОэтому если кто то думает вливать свои деньги в организацию www.cybbet.com. Готовтесь, что вы там деньги свои и похороните. Хотя мой аккаунт не заблокировали свои и заработанные деньги я вывел. Но дальше я там играть не могу. ТАк как меня заблокировали и вас заблокируют. в то время я заходил по адресу r3.cybbet.com+ ", 2017-01-10, 1, Otzovik.com, skualgrob, " Удобный классный интерфейс. Не плохие коэфициенты ", " Режут ставки ! ! "
Лига Ставок, "Плюсы: Нет! Минусы: Одни минусы у них. Комментарий: Сделал 6 ноября 2016г., ставку на Трампа. 1000руб. Через 5 дней пришел за деньгами. Выигрыш не отдают, говорят, событие не произошло, только после инаугурации. Звоните по телефону - 88005554455. Звонил, названивал, ответ, одно и тоже: после инаугурации. Пришел, сегодня 21.01.2017г., говорю, вот чек, паспорт, верните мои деньги. Ответ, вы просрочили месяц, я говорю, так приходил, звонил, вы не отдавали, они, надо было после голосования выборщиков (19 декабря 2016г.) приходить. Я отвечаю, так ведь приходил и 23.12.2016г., после голосования выборщиков, вы же мне опять сказали сами: только после инаугурации, (я говорю, а где ж выборщики? Они, ну звоните по тому же тел.). Примечание: ниже дописано 26.01.2017г. После инаугурации 2 раза опять звонил, приходил, ничего не отдали! Кстати, один раз по тел. сказали, приходите, отдадим. Пришел, зря время потерял. Не отдали.Никому не советую этих(((([Цензура]. Закрывать надо эту контору, а их руководителей судить! А уж суд им должен наказание назначить.Будем над этим работать. ", 2017-01-21, 1, Otzovik.com, NeVrun, " Нет! ", " Одни минусы у них. "
